{
  "$schema": "../../../schemas/component-descriptor.schema.json",
  "name": "ShimmerButton",
  "slug": "shimmer-button",
  "description": "A button with a CSS gradient sweep highlight on hover, drawing attention to primary CTAs.",
  "category": "animations",
  "version": "1.0.0",
  "supportedStack": {
    "react": ">=18",
    "next": ">=14",
    "tailwind": ">=4"
  },
  "tags": ["button", "hover", "shimmer", "cta", "highlight", "gradient"],
  "since": "0.2.0",
  "props": {
    "children": {
      "type": "ReactNode",
      "required": true,
      "description": "Button label or content"
    },
    "shimmerColor": {
      "type": "string",
      "required": false,
      "default": "rgba(255,255,255,0.1)",
      "description": "Color of the shimmer highlight"
    },
    "shimmerWidth": {
      "type": "string",
      "required": false,
      "default": "200%",
      "description": "Width of the shimmer gradient band"
    },
    "duration": {
      "type": "number",
      "required": false,
      "default": 1.5,
      "description": "Duration of the shimmer sweep in seconds"
    },
    "className": {
      "type": "string",
      "required": false,
      "description": "Additional Tailwind classes"
    },
    "id": {
      "type": "string",
      "required": false,
      "description": "HTML id attribute"
    }
  },
  "slots": [
    {
      "name": "children",
      "type": "ReactNode",
      "description": "Button label text or icon content",
      "required": true
    }
  ],
  "layout": {
    "display": "inline-flex",
    "responsive": false,
    "description": "Renders as an inline-flex button element. Drop-in replacement for standard buttons."
  },
  "variants": {},
  "dependencies": {
    "runtime": [],
    "peer": ["react", "react-dom"]
  },
  "recommendedWith": ["MagneticHover", "FadeUp"],
  "aiPromptHint": "Use ShimmerButton for primary CTAs that need visual emphasis. The sweep highlight draws attention on hover. Customize shimmerColor to match your brand. Works as a drop-in button replacement.",
  "examples": [
    {
      "title": "Basic shimmer CTA",
      "code": "<ShimmerButton className=\"bg-white text-black\">\n  Get Started\n</ShimmerButton>"
    },
    {
      "title": "Branded shimmer color",
      "code": "<ShimmerButton\n  shimmerColor=\"rgba(238,80,44,0.2)\"\n  className=\"bg-neutral-900 text-white border border-neutral-700\"\n>\n  Launch App\n</ShimmerButton>"
    },
    {
      "title": "Slow shimmer",
      "code": "<ShimmerButton duration={3} className=\"bg-gradient-to-r from-purple-600 to-pink-600 text-white\">\n  Explore\n</ShimmerButton>"
    },
    {
      "title": "Combined with MagneticHover",
      "code": "<MagneticHover>\n  <ShimmerButton className=\"bg-white text-black\">\n    Sign Up Free\n  </ShimmerButton>\n</MagneticHover>"
    }
  ]
}
